{
  "name": "assist-plugin-marketplace",
  "description": "Assist Plugin: Phase-aware workflow for creating Claude Code components (skills, agents, commands, hooks, MCP)",
  "version": "0.4.2",
  "owner": {
    "name": "Chanho KIM"
  },
  "plugins": [
    {
      "name": "assist-plugin",
      "description": "Smart scaffolding tool for Claude Code plugins with phase-aware context injection and schema validation gates",
      "source": "./",
      "version": "0.4.2",
      "author": {
        "name": "Chanho KIM"
      },
      "category": "productivity",
      "skills": [
        "./skills/phase-intent",
        "./skills/phase-semantic",
        "./skills/phase-execute",
        "./skills/phase-verify"
      ],
      "commands": [
        "./commands/assist.md",
        "./commands/verify.md"
      ],
      "agents": [
        "./agents/component-architect.md",
        "./agents/phase-semantic-agent.md",
        "./agents/phase-execute-agent.md",
        "./agents/phase-verify-agent.md"
      ],
      "hooks": [
        "./hooks/hooks.json"
      ]
    }
  ]
}
